{
  "schema_version": "2.0",
  "video_id": "source-hash-reproduction",
  "episode_content_hash": "b96bd649556fe94ddc5c5adfcf33607370b4ef066d3cf8cdcd69f883a985b463",
  "bindings": [
    {
      "cue_id": "q0001",
      "scene_id": "s001",
      "text_sha256": "0573298a7feca97b321502333047cc412bbbffdca5b1f285549e0530a45adf6a",
      "evidence_status": "conceptual",
      "conceptual": true,
      "claims": []
    },
    {
      "cue_id": "q0002",
      "scene_id": "s001",
      "text_sha256": "5814b06b81a193ea319891b49fc84970f2ff7384b0e228dd544cf97325016e23",
      "evidence_status": "confirmed",
      "conceptual": false,
      "claims": [
        {
          "claim_id": "conceptual-label-rule",
          "allowed_wording": "Teaching diagrams, proposed mechanisms, and hypotheses must be visibly labeled and may not be presented as measured traces.",
          "type": "fact",
          "status": "confirmed",
          "scope": "video evidence contract",
          "measurement_boundary": "editorial/visual status",
          "comparator": "none",
          "ratio_direction": "not a ratio",
          "uncertainty": "not applicable",
          "sources": [
            {
              "source_id": "src-recognition-readme",
              "path": "docs/recognition/README.md",
              "sha256": "1f48331bccac055cbda04f9cd8a213d36da77825e6e67f146180ebe61e93825e",
              "locator": "program scope and promotion boundaries"
            },
            {
              "source_id": "src-correction-report",
              "path": "deliverables_n22_24/corrections_2026_08_25/CM_BENCHMARK_AUDIT_CORRECTION_REPORT_2026-08-25.md",
              "sha256": "878336141ef1fc5a6a6fc78db7ca57cc18468076df18378bc05bb3a4a7e1c046",
              "locator": "workload-specific interpretation"
            }
          ]
        },
        {
          "claim_id": "source-provenance-contract",
          "allowed_wording": "A video production artifact is reproducible only when source locators, source hashes, claim IDs, script/storyboard identities, render jobs, outputs, and approval identities remain linked.",
          "type": "fact",
          "status": "confirmed",
          "scope": "CM video factory and RunPod safety contract",
          "measurement_boundary": "production provenance",
          "comparator": "none",
          "ratio_direction": "not a ratio",
          "uncertainty": "hash identity does not itself establish scientific truth",
          "sources": [
            {
              "source_id": "src-video-factory",
              "path": "docs/video_factory/factory.py",
              "sha256": "def7b733a2c90c14d7949cd933ed01b7c3a91fa7323342b90989f8c13014d879",
              "locator": "source registry, brief_content_hash and validation"
            },
            {
              "source_id": "src-runpod-handoff",
              "path": "docs/runpod/RUNPOD-SETUP-HANDOFF-2026-08-28.md",
              "sha256": "a2bc7c7eef5fa8794c3ee9ab86b010fc3cc5db05ff32cacdf443951e91cb2e79",
              "locator": "hash-bound authorization and verification"
            }
          ]
        }
      ]
    },
    {
      "cue_id": "q0003",
      "scene_id": "s001",
      "text_sha256": "3806de3a5e6d532626f3db95b0b0656e14d13ee4ce1f5313c025b697698b48b4",
      "evidence_status": "conceptual",
      "conceptual": true,
      "claims": []
    },
    {
      "cue_id": "q0004",
      "scene_id": "s002",
      "text_sha256": "d84414099e8bd9c2b16cc00e39dbc8215bfa55156041db97a127eac0d368f217",
      "evidence_status": "confirmed",
      "conceptual": false,
      "claims": [
        {
          "claim_id": "conceptual-label-rule",
          "allowed_wording": "Teaching diagrams, proposed mechanisms, and hypotheses must be visibly labeled and may not be presented as measured traces.",
          "type": "fact",
          "status": "confirmed",
          "scope": "video evidence contract",
          "measurement_boundary": "editorial/visual status",
          "comparator": "none",
          "ratio_direction": "not a ratio",
          "uncertainty": "not applicable",
          "sources": [
            {
              "source_id": "src-recognition-readme",
              "path": "docs/recognition/README.md",
              "sha256": "1f48331bccac055cbda04f9cd8a213d36da77825e6e67f146180ebe61e93825e",
              "locator": "program scope and promotion boundaries"
            },
            {
              "source_id": "src-correction-report",
              "path": "deliverables_n22_24/corrections_2026_08_25/CM_BENCHMARK_AUDIT_CORRECTION_REPORT_2026-08-25.md",
              "sha256": "878336141ef1fc5a6a6fc78db7ca57cc18468076df18378bc05bb3a4a7e1c046",
              "locator": "workload-specific interpretation"
            }
          ]
        },
        {
          "claim_id": "source-provenance-contract",
          "allowed_wording": "A video production artifact is reproducible only when source locators, source hashes, claim IDs, script/storyboard identities, render jobs, outputs, and approval identities remain linked.",
          "type": "fact",
          "status": "confirmed",
          "scope": "CM video factory and RunPod safety contract",
          "measurement_boundary": "production provenance",
          "comparator": "none",
          "ratio_direction": "not a ratio",
          "uncertainty": "hash identity does not itself establish scientific truth",
          "sources": [
            {
              "source_id": "src-video-factory",
              "path": "docs/video_factory/factory.py",
              "sha256": "def7b733a2c90c14d7949cd933ed01b7c3a91fa7323342b90989f8c13014d879",
              "locator": "source registry, brief_content_hash and validation"
            },
            {
              "source_id": "src-runpod-handoff",
              "path": "docs/runpod/RUNPOD-SETUP-HANDOFF-2026-08-28.md",
              "sha256": "a2bc7c7eef5fa8794c3ee9ab86b010fc3cc5db05ff32cacdf443951e91cb2e79",
              "locator": "hash-bound authorization and verification"
            }
          ]
        }
      ]
    },
    {
      "cue_id": "q0005",
      "scene_id": "s002",
      "text_sha256": "12e44ea7395666d9beae468b52eb30226858ccf9f6aefe71c6839243c36cc916",
      "evidence_status": "conceptual",
      "conceptual": true,
      "claims": []
    },
    {
      "cue_id": "q0006",
      "scene_id": "s002",
      "text_sha256": "c6fe509141f4e672c9b64907b6d1c38a4c1cc408ffa315cb89347848587171d6",
      "evidence_status": "conceptual",
      "conceptual": true,
      "claims": []
    },
    {
      "cue_id": "q0007",
      "scene_id": "s003",
      "text_sha256": "0d29e5450cc7807285ec25850b2191d509b9a5c6e33991e73c9db9f4a3645931",
      "evidence_status": "conceptual",
      "conceptual": true,
      "claims": []
    },
    {
      "cue_id": "q0008",
      "scene_id": "s003",
      "text_sha256": "0ca78807875b929fb4d869ca4f747a8bcded7506eb6cc9c527248f4fbc883199",
      "evidence_status": "conceptual",
      "conceptual": true,
      "claims": []
    },
    {
      "cue_id": "q0009",
      "scene_id": "s004",
      "text_sha256": "e9deef7153d9239eb7c855a53d03e6a9cad3c55ffc754a6a384794c784719990",
      "evidence_status": "conceptual",
      "conceptual": true,
      "claims": []
    },
    {
      "cue_id": "q0010",
      "scene_id": "s004",
      "text_sha256": "39adabcae3dd3fe0db24b7b98bd3f7c2ad7f3ef4e1780a9f8e7e51e5b5d8a720",
      "evidence_status": "conceptual",
      "conceptual": true,
      "claims": []
    },
    {
      "cue_id": "q0011",
      "scene_id": "s004",
      "text_sha256": "06056a6f0df0dcd045d01b7cf006584edcbe8a72439205d534b8073bd381e0e3",
      "evidence_status": "conceptual",
      "conceptual": true,
      "claims": []
    },
    {
      "cue_id": "q0012",
      "scene_id": "s005",
      "text_sha256": "83515dabb3aa1d6b6d4fa54b75f12c42a812bba3e2db0eb05fec1c8f60b543c5",
      "evidence_status": "conceptual",
      "conceptual": true,
      "claims": []
    },
    {
      "cue_id": "q0013",
      "scene_id": "s005",
      "text_sha256": "83729225dac1e5f1d3fb638c6c74bf4f68db6230f5d73584636c688cdbb43544",
      "evidence_status": "conceptual",
      "conceptual": true,
      "claims": []
    },
    {
      "cue_id": "q0014",
      "scene_id": "s005",
      "text_sha256": "a722c553a50791052b18e82678624ed23e34426fead5d8c4595575401f4dfb08",
      "evidence_status": "conceptual",
      "conceptual": false,
      "claims": [
        {
          "claim_id": "conceptual-label-rule",
          "allowed_wording": "Teaching diagrams, proposed mechanisms, and hypotheses must be visibly labeled and may not be presented as measured traces.",
          "type": "fact",
          "status": "confirmed",
          "scope": "video evidence contract",
          "measurement_boundary": "editorial/visual status",
          "comparator": "none",
          "ratio_direction": "not a ratio",
          "uncertainty": "not applicable",
          "sources": [
            {
              "source_id": "src-recognition-readme",
              "path": "docs/recognition/README.md",
              "sha256": "1f48331bccac055cbda04f9cd8a213d36da77825e6e67f146180ebe61e93825e",
              "locator": "program scope and promotion boundaries"
            },
            {
              "source_id": "src-correction-report",
              "path": "deliverables_n22_24/corrections_2026_08_25/CM_BENCHMARK_AUDIT_CORRECTION_REPORT_2026-08-25.md",
              "sha256": "878336141ef1fc5a6a6fc78db7ca57cc18468076df18378bc05bb3a4a7e1c046",
              "locator": "workload-specific interpretation"
            }
          ]
        },
        {
          "claim_id": "source-provenance-contract",
          "allowed_wording": "A video production artifact is reproducible only when source locators, source hashes, claim IDs, script/storyboard identities, render jobs, outputs, and approval identities remain linked.",
          "type": "fact",
          "status": "confirmed",